<!ELEMENT listaCompras   (venta+)>
        <!ELEMENT venta          (ventaACredito|ventaInmediata)>
                <!ELEMENT ventaACredito  (fechaFinPago?, cantidad)>
                <!ELEMENT ventaInmediata (cantidad, divisa)>
                        <!ELEMENT fechaFinPago   (#PCDATA)>
                        <!ELEMENT cantidad       (#PCDATA)>
                        <!ELEMENT divisa         (#PCDATA)>